{
  "incident_id": "demo-currency-stopped-112657",
  "generated_at": "2026-10-24T06:06:45Z",
  "alert": "Error rate elevated on frontend",
  "status": "diagnosed",
  "root_cause": {
    "service": "currency",
    "fault_type": "service_down",
    "summary": "The currency microservice container exited, making its gRPC endpoint unreachable. Checkout attempts to convert prices fail, propagating errors to frontend and raising the frontend error rate."
  },
  "symptom_services": [
    "frontend",
    "checkout",
    "frontend-proxy"
  ],
  "confidence": 0.6,
  "confidence_label": "medium",
  "evidence": [
    {
      "service": "currency",
      "metric": "container.not_running",
      "value": "exited",
      "promql": "docker inspect currency",
      "timestamp": "2026-10-24T05:58:20Z",
      "reference": "metric-5",
      "kind": "metric",
      "why_it_matters": "Container health shows currency NOT_RUNNING (exited)."
    },
    {
      "service": "currency",
      "metric": "container_state",
      "value": "exited",
      "promql": "docker inspect currency (State.Status)",
      "timestamp": "2026-10-24T06:00:33Z",
      "deviation_score": 10.0,
      "reference": "metric-6",
      "kind": "metric",
      "why_it_matters": "Service health marks currency as NOT_REPORTING: DOWN."
    },
    {
      "trace_id": "8249206695bae9c9b61e810291e2b46f",
      "service": "checkout",
      "span_name": "oteldemo.CurrencyService/Convert",
      "duration_ms": 0.0,
      "status": "ERROR",
      "exception": "name resolver error: produced zero addresses",
      "timestamp": "2026-10-24T06:01:27Z",
      "reference": "trace-10",
      "kind": "trace",
      "why_it_matters": "Deepest failing span is checkout \u2192 CurrencyService/Convert with a name resolver error, indicating the callee is unavailable."
    },
    {
      "service": "frontend",
      "metric": "error_ratio",
      "value": 0.1176,
      "promql": "sum by (service_name) (rate(traces_span_metrics_calls_total{status_code=\"STATUS_CODE_ERROR\"}[5m])) / sum by (service_name) (rate(traces_span_metrics_calls_total[5m]))",
      "timestamp": "2026-10-24T06:00:32Z",
      "baseline": 0.0008,
      "deviation_score": 2.336,
      "reference": "metric-8",
      "kind": "metric",
      "why_it_matters": "Checkout error ratio spiked, matching the currency outage."
    }
  ],
  "proposed_action": {
    "action": "restart_service",
    "target": "currency",
    "parameters": {},
    "reason": "Currency service container is exited, causing checkout failures; restarting will bring it back online.",
    "requires_approval": true
  },
  "investigation": {
    "tool_calls": 6,
    "tools_used": [
      "get_container_health",
      "get_deploy_history",
      "get_service_health",
      "search_logs",
      "search_traces"
    ],
    "model": "openai/gpt-oss-120b",
    "duration_seconds": 587.1,
    "calibration_notes": [
      "confidence capped from 0.88 to 0.70: only 1 evidence kind(s) name currency",
      "confidence lowered from 0.70 to 0.60: the reviewer disputed it with a grounded alternative (checkout, deviation 10.139 vs 10.0 for currency)"
    ]
  },
  "timeline": [
    {
      "time": "2026-10-24T05:56:58Z",
      "event": "Alert received: Error rate elevated on frontend"
    },
    {
      "time": "2026-10-24T06:06:45Z",
      "event": "Diagnosis submitted after 6 tool calls"
    }
  ],
  "prevention": "Add health checks and automatic restart policy for the currency container.",
  "review": {
    "ran": true,
    "disputed": true,
    "better_candidate": "checkout",
    "verdict": "DISPUTED: checkout\u2019s deviation_score (10.139) exceeds currency\u2019s and the trace shows a name\u2011resolver error, indicating a checkout\u2011side DNS/availability issue rather than the currency container being down | better candidate: checkout",
    "model": "openai/gpt-oss-120b",
    "grounded": true
  },
  "action_loop": {
    "started_at": "2026-10-24T06:07:47Z",
    "proposed": {
      "action": "restart_service",
      "target": "currency",
      "parameters": {},
      "reason": "Currency service container is exited, causing checkout failures; restarting will bring it back online.",
      "requires_approval": true
    },
    "mode": "interactive",
    "dry_run": {
      "ok": true,
      "command": "docker restart currency",
      "effect": "Container currency stops and starts (or starts, if it was stopped). Requests to it fail for a few seconds; in-memory state (caches, leaked memory) is cleared.",
      "reversible": false,
      "undo": "none needed: a restart changes no configuration"
    },
    "parameters": {},
    "approved": false,
    "approved_by": null,
    "approved_at": "2026-10-24T06:07:59Z",
    "outcome": "rejected by the human: no change was made",
    "finished_at": "2026-10-24T06:07:59Z",
    "action_log_entries": [
      {
        "incident_id": "demo-currency-stopped-112657",
        "purpose": "rejected by the human",
        "action": "restart_service",
        "target": "currency",
        "parameters": {},
        "approved": false,
        "planned": {
          "ok": true,
          "command": "docker restart currency",
          "effect": "Container currency stops and starts (or starts, if it was stopped). Requests to it fail for a few seconds; in-memory state (caches, leaked memory) is cleared.",
          "reversible": false,
          "undo": "none needed: a restart changes no configuration"
        },
        "result": {
          "ok": false,
          "reason": "rejected by the human"
        },
        "logged_at": "2026-10-24T06:07:59Z"
      }
    ]
  }
}