{
  "incident_id": "live-payment-1",
  "generated_at": "2026-10-23T10:12:41Z",
  "alert": "Error rate above 5% on frontend checkout requests",
  "status": "diagnosed",
  "root_cause": {
    "service": "payment",
    "fault_type": "application_error",
    "summary": "The payment service is rejecting checkout requests with an Invalid token error, leading to a high error rate observed on frontend checkout endpoints. Users see checkout failures. Metrics, traces, and logs all point to payment as the source."
  },
  "symptom_services": [
    "checkout",
    "frontend",
    "frontend-proxy",
    "load-generator"
  ],
  "confidence": 0.85,
  "confidence_label": "high",
  "evidence": [
    {
      "service": "payment",
      "metric": "error_ratio",
      "value": 0.8148,
      "promql": "sum by (service_name) (rate(traces_span_metrics_calls_total{status_code=\"STATUS_CODE_ERROR\"}[5m])) / sum by (service_name) (rate(traces_span_metrics_calls_total[5m]))",
      "timestamp": "2026-10-23T10:12:05Z",
      "reference": "metric-2",
      "kind": "metric",
      "why_it_matters": "Payment service error ratio 81%"
    },
    {
      "trace_id": "f634a9946c32ce7980d5997350b055cb",
      "service": "payment",
      "span_name": "charge",
      "duration_ms": 0.4,
      "status": "ERROR",
      "exception": "Payment request failed. Invalid token. demo.user_context.loyalty_level=gold",
      "reference": "trace-5",
      "kind": "trace",
      "why_it_matters": "Deepest failing span is payment charge :: Invalid token"
    },
    {
      "timestamp": "2026-10-23T10:11:55.402Z",
      "service": "payment",
      "severity": "warn",
      "message": "Payment request failed. Invalid token. demo.user_context.loyalty_level=gold",
      "trace_id": "f634a9946c32ce7980d5997350b055cb",
      "reference": "log-10",
      "kind": "log",
      "why_it_matters": "Warn log shows repeated Invalid token messages"
    }
  ],
  "proposed_action": {
    "action": "restart_service",
    "target": "payment",
    "reason": "Payment service is returning Invalid token errors for all checkout attempts, causing high error rates.",
    "requires_approval": true
  },
  "investigation": {
    "tool_calls": 3,
    "tools_used": [
      "get_service_health",
      "search_logs",
      "search_traces"
    ],
    "model": "openai/gpt-oss-120b",
    "duration_seconds": 36.9,
    "calibration_notes": []
  },
  "timeline": [
    {
      "time": "2026-10-23T10:12:05Z",
      "event": "Alert received: Error rate above 5% on frontend checkout requests"
    },
    {
      "time": "2026-10-23T10:11:55.402Z",
      "event": "Earliest cited log line from payment"
    },
    {
      "time": "2026-10-23T10:12:41Z",
      "event": "Diagnosis submitted after 3 tool calls"
    }
  ],
  "prevention": "Add validation for token generation and ensure token freshness; monitor token errors."
}