{
  "incident_id": "cart-cache-down",
  "generated_at": "2026-10-23T20:51:27Z",
  "alert": "Error rate elevated on frontend cart operations",
  "status": "diagnosed",
  "root_cause": {
    "service": "frontend-proxy",
    "fault_type": "application_error",
    "summary": "The frontend-proxy is producing errors when routing cart requests, causing elevated error rates for cart operations. Traces show the error originates in the frontend-proxy router, and the container is otherwise healthy. Restarting the service should resolve the issue."
  },
  "symptom_services": [
    "cart"
  ],
  "confidence": 0.6,
  "confidence_label": "medium",
  "evidence": [
    {
      "trace_id": "cf0aacc354980d1233c4c2e671939f9c",
      "service": "frontend-proxy",
      "span_name": "router frontend egress",
      "duration_ms": 3063.1,
      "status": "ERROR",
      "exception": null,
      "timestamp": "2026-10-23T20:47:13Z",
      "reference": "trace-1",
      "kind": "trace",
      "why_it_matters": "Shows deepest failing span in frontend-proxy router frontend egress, indicating the error originates in frontend-proxy."
    }
  ],
  "proposed_action": {
    "action": "restart_service",
    "target": "frontend-proxy",
    "parameters": {},
    "reason": "The frontend-proxy container is healthy but is generating errors when routing requests, as shown by the deepest failing span in recent traces. Restarting it may clear transient state and reduce error rate.",
    "requires_approval": true
  },
  "investigation": {
    "tool_calls": 4,
    "tools_used": [
      "get_container_health",
      "get_service_health",
      "search_logs",
      "search_traces"
    ],
    "model": "openai/gpt-oss-20b",
    "duration_seconds": 250.9,
    "calibration_notes": []
  },
  "timeline": [
    {
      "time": "2026-10-23T20:47:16Z",
      "event": "Alert received: Error rate elevated on frontend cart operations"
    },
    {
      "time": "2026-10-23T20:51:27Z",
      "event": "Diagnosis submitted after 4 tool calls"
    }
  ],
  "prevention": "Implement stricter health checks and automatic restarts for frontend-proxy when error ratio exceeds threshold.",
  "review": {
    "ran": true,
    "disputed": true,
    "better_candidate": "recommendation",
    "verdict": "DISPUTED: The evidence only shows a single trace with an ERROR in frontend\u2011proxy, but the recommendation service has a comparable deviation score (1.283) and could be the true source of cart failures; better candidate: recommendation",
    "model": "openai/gpt-oss-20b",
    "grounded": true
  }
}